{
  "run_id": "2026-10-09T14:00:00Z",
  "pumps_available": 6,
  "assignments": [
    {
      "hotspot_id": "DL-004",
      "pumps": 2,
      "level": "CRITICAL",
      "risk": 0.606
    },
    {
      "hotspot_id": "DL-001",
      "pumps": 1,
      "level": "HIGH",
      "risk": 0.522
    },
    {
      "hotspot_id": "DL-005",
      "pumps": 1,
      "level": "HIGH",
      "risk": 0.519
    },
    {
      "hotspot_id": "DL-002",
      "pumps": 1,
      "level": "HIGH",
      "risk": 0.44
    },
    {
      "hotspot_id": "DL-003",
      "pumps": 1,
      "level": "HIGH",
      "risk": 0.354
    }
  ],
  "unassigned": []
}
